{
  "$schema": "https://json-schema.org/draft/2020-12/schema",
  "$id": "https://example.local/engineering-ui-kit/capabilities/application-specification.schema.json",
  "title": "CAP-CONTRACT-001",
  "type": "object",
  "additionalProperties": false,
  "required": [
    "schemaVersion",
    "projectId",
    "id",
    "revision",
    "status",
    "purpose",
    "outcomes",
    "actors",
    "goals",
    "useCases",
    "scenarios",
    "information",
    "rules",
    "externalSystems",
    "constraints",
    "scope",
    "acceptanceCases",
    "sources",
    "unresolvedQuestions",
    "contentHash"
  ],
  "properties": {
    "schemaVersion": {
      "const": "1.0"
    },
    "projectId": {
      "type": "string",
      "minLength": 1
    },
    "id": {
      "type": "string",
      "minLength": 1
    },
    "revision": {
      "type": "string",
      "minLength": 1
    },
    "status": {
      "enum": [
        "draft",
        "proposed",
        "approved",
        "superseded"
      ]
    },
    "purpose": {
      "type": "string",
      "minLength": 1
    },
    "outcomes": {
      "type": "array",
      "items": {
        "type": "string"
      }
    },
    "actors": {
      "type": "array",
      "items": {
        "type": "object",
        "required": [
          "id",
          "text"
        ],
        "properties": {
          "id": {
            "type": "string",
            "minLength": 1
          },
          "text": {
            "type": "string",
            "minLength": 1
          }
        },
        "additionalProperties": false
      }
    },
    "goals": {
      "type": "array",
      "items": {
        "type": "object",
        "required": [
          "id",
          "text"
        ],
        "properties": {
          "id": {
            "type": "string",
            "minLength": 1
          },
          "text": {
            "type": "string",
            "minLength": 1
          }
        },
        "additionalProperties": false
      }
    },
    "useCases": {
      "type": "array",
      "items": {
        "type": "object",
        "required": [
          "id",
          "text"
        ],
        "properties": {
          "id": {
            "type": "string",
            "minLength": 1
          },
          "text": {
            "type": "string",
            "minLength": 1
          }
        },
        "additionalProperties": false
      }
    },
    "scenarios": {
      "type": "array",
      "items": {
        "type": "object",
        "required": [
          "id",
          "text"
        ],
        "properties": {
          "id": {
            "type": "string",
            "minLength": 1
          },
          "text": {
            "type": "string",
            "minLength": 1
          }
        },
        "additionalProperties": false
      }
    },
    "information": {
      "type": "array",
      "items": {
        "type": "object",
        "required": [
          "id",
          "text"
        ],
        "properties": {
          "id": {
            "type": "string",
            "minLength": 1
          },
          "text": {
            "type": "string",
            "minLength": 1
          }
        },
        "additionalProperties": false
      }
    },
    "rules": {
      "type": "array",
      "items": {
        "type": "object",
        "required": [
          "id",
          "text"
        ],
        "properties": {
          "id": {
            "type": "string",
            "minLength": 1
          },
          "text": {
            "type": "string",
            "minLength": 1
          }
        },
        "additionalProperties": false
      }
    },
    "externalSystems": {
      "type": "array",
      "items": {
        "type": "object",
        "required": [
          "id",
          "text"
        ],
        "properties": {
          "id": {
            "type": "string",
            "minLength": 1
          },
          "text": {
            "type": "string",
            "minLength": 1
          }
        },
        "additionalProperties": false
      }
    },
    "constraints": {
      "type": "array",
      "items": {
        "type": "object",
        "required": [
          "id",
          "text"
        ],
        "properties": {
          "id": {
            "type": "string",
            "minLength": 1
          },
          "text": {
            "type": "string",
            "minLength": 1
          }
        },
        "additionalProperties": false
      }
    },
    "scope": {
      "type": "object",
      "required": [
        "inScope",
        "outOfScope"
      ],
      "properties": {
        "inScope": {
          "type": "array",
          "items": {
            "type": "string"
          }
        },
        "outOfScope": {
          "type": "array",
          "items": {
            "type": "string"
          }
        }
      },
      "additionalProperties": false
    },
    "acceptanceCases": {
      "type": "array",
      "items": {
        "type": "object",
        "required": [
          "id",
          "description",
          "expectedOutcome"
        ],
        "properties": {
          "id": {
            "type": "string",
            "minLength": 1
          },
          "description": {
            "type": "string",
            "minLength": 1
          },
          "expectedOutcome": {
            "type": "string",
            "minLength": 1
          },
          "kind": {
            "enum": [
              "example",
              "failure"
            ]
          }
        },
        "additionalProperties": false
      }
    },
    "sources": {
      "type": "array",
      "items": {
        "type": "object",
        "required": [
          "id",
          "text"
        ],
        "properties": {
          "id": {
            "type": "string",
            "minLength": 1
          },
          "text": {
            "type": "string",
            "minLength": 1
          }
        },
        "additionalProperties": false
      }
    },
    "unresolvedQuestions": {
      "type": "array",
      "items": {
        "type": "object",
        "required": [
          "id",
          "text"
        ],
        "properties": {
          "id": {
            "type": "string",
            "minLength": 1
          },
          "text": {
            "type": "string",
            "minLength": 1
          }
        },
        "additionalProperties": false
      }
    },
    "useCaseDefinitions": {
      "type": "array",
      "items": {
        "type": "object"
      }
    },
    "applicationWorkflows": {
      "type": "array",
      "items": {
        "$ref": "application-workflow.schema.json"
      }
    },
    "scenarioDefinitions": {
      "type": "array",
      "items": {
        "type": "object"
      }
    },
    "approvedAt": {
      "type": "string"
    },
    "approvedBy": {
      "type": "string"
    },
    "contentHash": {
      "type": "string",
      "minLength": 1
    }
  }
}
